{
  "$schema": "http://json-schema.org/draft-07/schema#",
  "$id": "https://github.com/OpenCoven/familiar-contract/schemas/familiar-embodiment-binding.schema.json",
  "title": "Familiar Embodiment Binding v1",
  "description": "A privacy-minimized, versioned dispatch or historical-verification record proving the exact stable familiar root and identity revision embodied by one concrete execution. It is not a scheduler lifecycle record or protected-action authorization.",
  "type": "object",
  "additionalProperties": false,
  "required": ["profile", "schemaVersion", "bindingId", "familiar", "identityBundle", "revisionRecordedAt", "validTime", "statusAtDecision", "principal", "target", "bindingPurpose", "identityMeaning", "issuedAt", "decisionAt", "policyVersion", "resolver", "verifier", "historicalVerification", "revocation", "commit", "integrity", "authentication", "privacy"],
  "properties": {
    "profile": { "const": "familiar.embodiment_binding.v1" },
    "schemaVersion": { "$ref": "#/definitions/version" },
    "bindingId": { "type": "string", "minLength": 1 },
    "familiar": {
      "type": "object", "additionalProperties": false,
      "required": ["familiarRootId", "identityRevisionId", "lineagePosition", "lineageEvidence"],
      "properties": {
        "familiarRootId": { "$ref": "#/definitions/opaqueId" },
        "identityRevisionId": { "$ref": "#/definitions/opaqueId" },
        "lineagePosition": { "type": "integer", "minimum": 0 },
        "lineageEvidence": {
          "type": "object", "additionalProperties": false,
          "required": ["relationship", "rootEvidence"],
          "properties": {
            "relationship": { "enum": ["genesis", "same_familiar_revision", "restoration", "fork_new_root", "succession"] },
            "rootEvidence": { "enum": ["genesis", "continued", "fork", "succession"] },
            "predecessor": {
              "type": "object", "additionalProperties": false,
              "required": ["familiarRootId", "identityRevisionId", "lineagePosition", "status"],
              "properties": {
                "familiarRootId": { "$ref": "#/definitions/opaqueId" },
                "identityRevisionId": { "$ref": "#/definitions/opaqueId" },
                "lineagePosition": { "type": "integer", "minimum": 0 },
                "status": { "enum": ["active", "retired", "revoked", "superseded"] }
              }
            }
          }
        }
      }
    },
    "aliasResolution": {
      "type": "object", "additionalProperties": false,
      "required": ["alias", "authoritative", "resolvedRootIds"],
      "properties": {
        "alias": { "type": "string", "minLength": 1 },
        "authoritative": { "const": false },
        "resolvedRootIds": { "type": "array", "minItems": 1, "items": { "$ref": "#/definitions/opaqueId" } }
      }
    },
    "identityBundle": {
      "type": "object", "additionalProperties": false,
      "required": ["canonicalization", "declarationDigest", "bundleDigest", "historicalBundleRef"],
      "properties": {
        "canonicalization": { "const": "jcs-rfc8785" },
        "declarationDigest": { "$ref": "#/definitions/digest" },
        "bundleDigest": { "$ref": "#/definitions/digest" },
        "historicalBundleRef": { "type": "string", "pattern": "^urn:sha256:[0-9a-f]{64}$" }
      }
    },
    "revisionRecordedAt": { "$ref": "#/definitions/timestamp" },
    "validTime": {
      "type": "object", "additionalProperties": false, "required": ["notBefore"],
      "properties": { "notBefore": { "$ref": "#/definitions/timestamp" }, "notAfter": { "$ref": "#/definitions/timestamp" } }
    },
    "statusAtDecision": {
      "type": "object", "additionalProperties": false, "required": ["status", "decisionTime"],
      "properties": { "status": { "enum": ["active", "retired", "revoked", "superseded"] }, "decisionTime": { "$ref": "#/definitions/timestamp" } }
    },
    "principal": {
      "type": "object", "additionalProperties": false, "required": ["authenticatedPrincipalId"],
      "properties": { "authenticatedPrincipalId": { "$ref": "#/definitions/opaqueId" }, "projectId": { "$ref": "#/definitions/opaqueId" }, "scopeId": { "$ref": "#/definitions/opaqueId" } }
    },
    "target": {
      "type": "object", "additionalProperties": false, "required": ["targetType", "targetId", "authenticatedPrincipalId"],
      "properties": {
        "targetType": { "enum": ["direct_session", "automation_run", "automation_attempt", "psyche_delegated_execution"] },
        "targetId": { "$ref": "#/definitions/opaqueId" },
        "authenticatedPrincipalId": { "$ref": "#/definitions/opaqueId" }
      }
    },
    "bindingPurpose": { "enum": ["dispatch", "session_creation", "historical_verification"] },
    "identityMeaning": { "const": "unchanged" },
    "issuedAt": { "$ref": "#/definitions/timestamp" },
    "decisionAt": { "$ref": "#/definitions/timestamp" },
    "policyVersion": { "type": "string", "minLength": 1 },
    "resolver": { "$ref": "#/definitions/actor" },
    "verifier": { "$ref": "#/definitions/actor" },
    "historicalVerification": {
      "type": "object", "additionalProperties": false, "required": ["state", "readAuthorization"],
      "properties": { "state": { "enum": ["verified", "degraded", "unavailable", "unverifiable"] }, "readAuthorization": { "enum": ["authorized", "not_authorized", "not_requested"] } }
    },
    "revocation": {
      "type": "object", "additionalProperties": false, "required": ["outcome"],
      "properties": { "outcome": { "enum": ["none", "before_commit", "after_commit"] }, "revokedAt": { "$ref": "#/definitions/timestamp" } }
    },
    "commit": {
      "type": "object", "additionalProperties": false, "required": ["snapshotId", "state", "finalValidityCheckAt", "committedAt", "verifiedBindingDigest"],
      "properties": {
        "snapshotId": { "$ref": "#/definitions/opaqueId" }, "state": { "const": "committed" },
        "finalValidityCheckAt": { "$ref": "#/definitions/timestamp" }, "committedAt": { "$ref": "#/definitions/timestamp" },
        "verifiedBindingDigest": { "$ref": "#/definitions/hash" }
      }
    },
    "integrity": {
      "type": "object", "additionalProperties": false, "required": ["algorithm", "canonicalization", "bindingDigest"],
      "properties": { "algorithm": { "const": "sha-256" }, "canonicalization": { "const": "jcs-rfc8785" }, "bindingDigest": { "$ref": "#/definitions/hash" } }
    },
    "authentication": {
      "type": "object", "additionalProperties": false, "required": ["method", "signerId", "signature"],
      "properties": { "method": { "enum": ["signature", "mTLS-attestation", "authenticated-channel"] }, "signerId": { "$ref": "#/definitions/opaqueId" }, "signature": { "type": "string", "minLength": 1 } }
    },
    "privacy": {
      "type": "object", "additionalProperties": false, "required": ["classification", "retention", "containsSensitiveIdentityContent"],
      "properties": { "classification": { "const": "metadata-only" }, "retention": { "enum": ["dispatch-audit-minimum", "historical-verification-minimum"] }, "containsSensitiveIdentityContent": { "const": false } }
    }
  },
  "definitions": {
    "opaqueId": { "type": "string", "pattern": "^[a-z][a-z0-9_-]*:[A-Za-z0-9._:-]+$" },
    "version": { "type": "string", "pattern": "^\\d+\\.\\d+\\.\\d+$" },
    "timestamp": { "type": "string", "pattern": "^\\d{4}-\\d{2}-\\d{2}T" },
    "hash": { "type": "string", "pattern": "^[0-9a-f]{64}$" },
    "digest": {
      "type": "object", "additionalProperties": false, "required": ["algorithm", "value"],
      "properties": { "algorithm": { "const": "sha-256" }, "value": { "$ref": "#/definitions/hash" } }
    },
    "actor": {
      "type": "object", "additionalProperties": false, "required": ["id", "version"],
      "properties": { "id": { "$ref": "#/definitions/opaqueId" }, "version": { "$ref": "#/definitions/version" } }
    }
  }
}
