{
  "profile": "familiar.embodiment_binding.v1",
  "schemaVersion": "1.0.0",
  "bindingId": "binding-15-revocation-after-commit",
  "familiar": {
    "familiarRootId": "familiar-root:oak",
    "identityRevisionId": "familiar-revision:oak:3",
    "lineagePosition": 3,
    "lineageEvidence": {
      "relationship": "same_familiar_revision",
      "rootEvidence": "continued",
      "predecessor": {
        "familiarRootId": "familiar-root:oak",
        "identityRevisionId": "familiar-revision:oak:2",
        "lineagePosition": 2,
        "status": "superseded"
      }
    }
  },
  "identityBundle": {
    "canonicalization": "jcs-rfc8785",
    "declarationDigest": {
      "algorithm": "sha-256",
      "value": "aaaaaaaaaaaaaaaaaaaaaaaaaaaaaaaaaaaaaaaaaaaaaaaaaaaaaaaaaaaaaaaa"
    },
    "bundleDigest": {
      "algorithm": "sha-256",
      "value": "bbbbbbbbbbbbbbbbbbbbbbbbbbbbbbbbbbbbbbbbbbbbbbbbbbbbbbbbbbbbbbbb"
    },
    "historicalBundleRef": "urn:sha256:bbbbbbbbbbbbbbbbbbbbbbbbbbbbbbbbbbbbbbbbbbbbbbbbbbbbbbbbbbbbbbbb"
  },
  "revisionRecordedAt": "2026-09-03T08:00:00Z",
  "validTime": {
    "notBefore": "2026-09-03T08:00:00Z"
  },
  "statusAtDecision": {
    "status": "active",
    "decisionTime": "2026-09-03T09:00:00Z"
  },
  "principal": {
    "authenticatedPrincipalId": "principal:val",
    "projectId": "project:oak",
    "scopeId": "scope:build"
  },
  "target": {
    "targetType": "direct_session",
    "targetId": "coven-session:123",
    "authenticatedPrincipalId": "principal:val"
  },
  "bindingPurpose": "dispatch",
  "identityMeaning": "unchanged",
  "issuedAt": "2026-09-03T09:00:00Z",
  "decisionAt": "2026-09-03T09:00:00Z",
  "policyVersion": "policy-2026-09",
  "resolver": {
    "id": "resolver:directory",
    "version": "1.0.0"
  },
  "verifier": {
    "id": "verifier:authority",
    "version": "1.0.0"
  },
  "historicalVerification": {
    "state": "verified",
    "readAuthorization": "not_requested"
  },
  "revocation": {
    "outcome": "after_commit",
    "revokedAt": "2026-09-03T09:00:01Z"
  },
  "integrity": {
    "algorithm": "sha-256",
    "canonicalization": "jcs-rfc8785",
    "bindingDigest": "b4e512b1bcc8d986cd000ae48de41a7eb1d4e95afa9fe7fa72b83e12ba990f20"
  },
  "authentication": {
    "method": "signature",
    "signerId": "authority:oak",
    "signature": "attested:opaque"
  },
  "privacy": {
    "classification": "metadata-only",
    "retention": "dispatch-audit-minimum",
    "containsSensitiveIdentityContent": false
  },
  "commit": {
    "snapshotId": "snapshot:oak-dispatch-001",
    "state": "committed",
    "finalValidityCheckAt": "2026-09-03T09:00:00Z",
    "committedAt": "2026-09-03T09:00:00Z",
    "verifiedBindingDigest": "b4e512b1bcc8d986cd000ae48de41a7eb1d4e95afa9fe7fa72b83e12ba990f20"
  }
}
